{
  "$schema": "https://json-schema.org/draft/2020-12/schema",
  "title": "Merestone controls 3.0",
  "type": "array",
  "items": {
    "type": "object",
    "properties": {
      "id": {
        "type": "string",
        "minLength": 1
      },
      "revision": {
        "type": "string",
        "minLength": 1
      },
      "title": {
        "type": "string",
        "minLength": 1
      },
      "invariant": {
        "type": "string"
      },
      "owner_role": {
        "type": "string"
      },
      "case_ids": {
        "type": "array",
        "items": {
          "type": "string",
          "minLength": 1
        }
      }
    },
    "required": [
      "id",
      "title",
      "invariant",
      "case_ids"
    ],
    "additionalProperties": false
  }
}
